name,description,price,stock,category,image
Vintage Oak Dining Table,A stunning solid oak dining table with a warm vintage finish. Seats up to 6 people comfortably. Perfect centerpiece for any dining room.,899.99,8,Tables & Chairs,https://images.unsplash.com/photo-1758977404038-8aa1845d6635?q=80&w=1054&auto=format&fit=crop&ixlib=rb-4.1.0&ixid=M3wxMjA3fDB8MHxwaG90by1wYWdlfHx8fGVufDB8fHx8fA%3D%3D
Mid-Century Sofa,A beautifully crafted mid-century modern sofa upholstered in premium fabric. Features tapered wooden legs and deep cushions for ultimate comfort.,1299.99,5,Sofas & Armchairs,https://images.unsplash.com/photo-1540574163026-643ea20ade25?w=800
Rustic Wooden Bookshelf,A charming rustic bookshelf crafted from reclaimed pine wood. Five spacious shelves for all your books and decorative items.,449.99,12,Storage Furniture,https://images.unsplash.com/photo-1603058817990-2b9a9abbce86?q=80&w=986&auto=format&fit=crop&ixlib=rb-4.1.0&ixid=M3wxMjA3fDB8MHxwaG90by1wYWdlfHx8fGVufDB8fHx8fA%3D%3D
Vintage Leather Armchair,A classic leather armchair with a timeless vintage design. Hand-stitched details and solid wood frame ensure lasting elegance.,799.99,6,Sofas & Armchairs,https://images.unsplash.com/photo-1605702098590-d552a98dc93d?q=80&w=986&auto=format&fit=crop&ixlib=rb-4.1.0&ixid=M3wxMjA3fDB8MHxwaG90by1wYWdlfHx8fGVufDB8fHx8fA%3D%3D
Antique Lamp,An elegant floor lamp with an antique brass finish and adjustable arm. Adds warm ambient lighting to any room.,249.99,15,Lighting,https://images.unsplash.com/photo-1617600273941-fc17e96eecad?q=80&w=987&auto=format&fit=crop&ixlib=rb-4.1.0&ixid=M3wxMjA3fDB8MHxwaG90by1wYWdlfHx8fGVufDB8fHx8fA%3D%3D
Farmhouse Bed Frame,A gorgeous farmhouse-style bed frame crafted from solid wood with a distressed white finish. Available in Queen and King sizes.,1099.99,7,Beds & Mattresses,https://images.unsplash.com/photo-1617198998846-56e8a4c6e7b7?q=80&w=987&auto=format&fit=crop&ixlib=rb-4.1.0&ixid=M3wxMjA3fDB8MHxwaG90by1wYWdlfHx8fGVufDB8fHx8fA%3D%3D
Woven Jute Area Rug,A handwoven jute area rug with a natural earthy tone. Adds warmth and texture to any living space. Available in 5x8 and 8x10 sizes.,199.99,20,Rugs & Home Textiles,https://images.unsplash.com/photo-1600166898405-da9535204843?w=800
Vintage Wall Mirror,An ornate vintage wall mirror with an aged gold frame. Perfect for hallways,329.99,10,Home Decor,https://images.unsplash.com/photo-1715249892473-b248858ff2a6?q=80&w=927&auto=format&fit=crop&ixlib=rb-4.1.0&ixid=M3wxMjA3fDB8MHxwaG90by1wYWdlfHx8fGVufDB8fHx8fA%3D%3D
Wood Coffee Table,A unique coffee table crafted from reclaimed wood with hairpin steel legs. Each piece is one-of-a-kind with its own natural character.,549.99,9,Tables & Chairs,https://images.unsplash.com/photo-1619911013257-8f1fbc919fc9?q=80&w=987&auto=format&fit=crop&ixlib=rb-4.1.0&ixid=M3wxMjA3fDB8MHxwaG90by1wYWdlfHx8fGVufDB8fHx8fA%3D%3D
Modern Bedside Table,A charming bedside table with a drawer and open shelf. Finished in antique white with brass hardware.,179.99,14,Beds & Mattresses,https://plus.unsplash.com/premium_photo-1734543942836-3f9a0c313da4?q=80&w=987&auto=format&fit=crop&ixlib=rb-4.1.0&ixid=M3wxMjA3fDB8MHxwaG90by1wYWdlfHx8fGVufDB8fHx8fA%3D%3D
Shelving Unit,A bold industrial-style shelving unit with reclaimed wood shelves and black iron pipe brackets. Perfect for modern loft spaces.,399.99,8,Storage Furniture,https://images.unsplash.com/photo-1766047125602-38a468895ffc?q=80&w=1180&auto=format&fit=crop&ixlib=rb-4.1.0&ixid=M3wxMjA3fDB8MHxwaG90by1wYWdlfHx8fGVufDB8fHx8fA%3D%3D
Velvet Chesterfield Sofa,A luxurious Chesterfield sofa upholstered in rich jewel-toned velvet. Deep button tufting and rolled arms give it a classic Victorian appeal.,1799.99,3,Sofas & Armchairs,https://images.unsplash.com/photo-1655149555422-bb79f0701829?q=80&w=987&auto=format&fit=crop&ixlib=rb-4.1.0&ixid=M3wxMjA3fDB8MHxwaG90by1wYWdlfHx8fGVufDB8fHx8fA%3D%3D
Rattan Pendant Light,A handwoven rattan pendant light that casts beautiful warm patterns. Ideal for dining rooms and cozy reading nooks.,149.99,18,Lighting,https://images.unsplash.com/photo-1768320912065-78aac5927678?q=80&w=987&auto=format&fit=crop&ixlib=rb-4.1.0&ixid=M3wxMjA3fDB8MHxwaG90by1wYWdlfHx8fGVufDB8fHx8fA%3D%3D
Vintage Dresser with Mirror,A stunning vintage dresser with six spacious drawers and an attached mirror. Finished in a chalky sage green with gold handles.,899.99,4,Beds & Mattresses,https://images.unsplash.com/photo-1715249891485-4b8e66b584dc?q=80&w=927&auto=format&fit=crop&ixlib=rb-4.1.0&ixid=M3wxMjA3fDB8MHxwaG90by1wYWdlfHx8fGVufDB8fHx8fA%3D%3D
Moroccan Pouf Ottoman,A hand-stitched genuine leather pouf in a classic Moroccan pattern. Doubles as a footrest or extra seating.,129.99,22,Sofas & Armchairs,https://images.unsplash.com/photo-1764685809128-5331510d392e?q=80&w=987&auto=format&fit=crop&ixlib=rb-4.1.0&ixid=M3wxMjA3fDB8MHxwaG90by1wYWdlfHx8fGVufDB8fHx8fA%3D%3D
Walnut Desk,A sleek solid walnut writing desk with two drawers and clean lines. Ideal for home offices and study spaces.,749.99,6,Desk & Desk Chairs,https://images.unsplash.com/photo-1657524432873-c37d2ac7b8cb?q=80&w=987&auto=format&fit=crop&ixlib=rb-4.1.0&ixid=M3wxMjA3fDB8MHxwaG90by1wYWdlfHx8fGVufDB8fHx8fA%3D%3D
Boho Macrame Wall Hanging,A large handcrafted macrame wall hanging made from natural cotton rope. A statement piece for any bohemian-inspired interior.,89.99,25,Home Decor,https://images.unsplash.com/photo-1632393121391-3c40fcfafe1a?q=80&w=1180&auto=format&fit=crop&ixlib=rb-4.1.0&ixid=M3wxMjA3fDB8MHxwaG90by1wYWdlfHx8fGVufDB8fHx8fA%3D%3D
Cast Iron Candle Holders Set,A set of three cast iron pillar candle holders with varying heights. Adds dramatic rustic charm to mantels and dining tables.,69.99,30,Home Decor,https://plus.unsplash.com/premium_photo-1696879451633-2e6bd6db1f94?q=80&w=988&auto=format&fit=crop&ixlib=rb-4.1.0&ixid=M3wxMjA3fDB8MHxwaG90by1wYWdlfHx8fGVufDB8fHx8fA%3D%3D
Tufted Velvet Bench,An elegant tufted bench upholstered in deep emerald velvet with a gold metal base. Perfect for the end of a bed or entryway.,379.99,8,Beds & Mattresses,https://images.unsplash.com/photo-1680770638423-6d4c1089bd7a?q=80&w=987&auto=format&fit=crop&ixlib=rb-4.1.0&ixid=M3wxMjA3fDB8MHxwaG90by1wYWdlfHx8fGVufDB8fHx8fA%3D%3D
Vintage Globe Bar Cabinet,A stunning vintage globe bar cabinet that opens to reveal a mirrored interior with bottle storage. A conversation-starting piece.,599.99,5,Storage Furniture,https://images.unsplash.com/photo-1729339671840-a5dbbc517f3d?q=80&w=997&auto=format&fit=crop&ixlib=rb-4.1.0&ixid=M3wxMjA3fDB8MHxwaG90by1wYWdlfHx8fGVufDB8fHx8fA%3D%3D
Linen Window Curtains,Elegant linen curtains in a natural off-white tone. Lightweight and airy,79.99,35,Window Treatments,https://images.unsplash.com/photo-1754613389158-3b13a051a81a?q=80&w=1180&auto=format&fit=crop&ixlib=rb-4.1.0&ixid=M3wxMjA3fDB8MHxwaG90by1wYWdlfHx8fGVufDB8fHx8fA%3D%3D
Wooden Ladder Shelf,A minimalist ladder-style shelf in natural pine. Five rungs provide ample display and storage space.,229.99,11,Storage Furniture,https://images.unsplash.com/photo-1762606368623-81bb2d5f5778?q=80&w=1180&auto=format&fit=crop&ixlib=rb-4.1.0&ixid=M3wxMjA3fDB8MHxwaG90by1wYWdlfHx8fGVufDB8fHx8fA%3D%3D
Antique Ceramic Table Lamp,A hand-painted ceramic table lamp with an ivory linen shade. Brings artisan character to bedrooms and living rooms.,189.99,13,Lighting,https://images.unsplash.com/photo-1689519304039-6662ac14e89a?q=80&w=1067&auto=format&fit=crop&ixlib=rb-4.1.0&ixid=M3wxMjA3fDB8MHxwaG90by1wYWdlfHx8fGVufDB8fHx8fA%3D%3D
Wicker Storage Basket Set,A set of three handwoven wicker storage baskets in graduated sizes. Great for organizing blankets,99.99,20,Storage Furniture,https://images.unsplash.com/photo-1769286145156-70a40fff80ec?q=80&w=987&auto=format&fit=crop&ixlib=rb-4.1.0&ixid=M3wxMjA3fDB8MHxwaG90by1wYWdlfHx8fGVufDB8fHx8fA%3D%3D
Herringbone Wool Throw Blanket,A cozy herringbone-patterned wool throw blanket in warm neutral tones. Perfect for layering on sofas and beds.,119.99,18,Rugs & Home Textiles,https://images.unsplash.com/photo-1637819976869-928427bd7380?q=80&w=1064&auto=format&fit=crop&ixlib=rb-4.1.0&ixid=M3wxMjA3fDB8MHxwaG90by1wYWdlfHx8fGVufDB8fHx8fA%3D%3D
Art Deco Dining Chairs Set of 2,A pair of stunning Art Deco dining chairs upholstered in boucle fabric with gold metal legs. Elevates any dining space.,459.99,7,Tables & Chairs,https://images.unsplash.com/photo-1691380303111-49566faa902e?q=80&w=957&auto=format&fit=crop&ixlib=rb-4.1.0&ixid=M3wxMjA3fDB8MHxwaG90by1wYWdlfHx8fGVufDB8fHx8fA%3D%3D
Vintage Trunk Storage Box,A vintage-inspired storage trunk with metal hardware and a faux leather exterior. Doubles as a coffee table or blanket chest.,289.99,9,Storage Furniture,https://images.unsplash.com/photo-1748512437466-b79a6c646092?q=80&w=987&auto=format&fit=crop&ixlib=rb-4.1.0&ixid=M3wxMjA3fDB8MHxwaG90by1wYWdlfHx8fGVufDB8fHx8fA%3D%3D
Terracotta Planter Set,A set of three handmade terracotta planters in graduated sizes. Adds earthy warmth to any room or outdoor patio.,59.99,28,Pots & Plants,https://images.unsplash.com/photo-1621512366232-0b7b78983782?q=80&w=987&auto=format&fit=crop&ixlib=rb-4.1.0&ixid=M3wxMjA3fDB8MHxwaG90by1wYWdlfHx8fGVufDB8fHx8fA%3D%3D
Rattan Lounge Chair,A comfortable rattan lounge chair with a plush cushion in natural linen. A boho-chic addition to any living room or sunroom.,499.99,6,Sofas & Armchairs,https://images.unsplash.com/photo-1623145571974-d9c41b34ca8d?q=80&w=987&auto=format&fit=crop&ixlib=rb-4.1.0&ixid=M3wxMjA3fDB8MHxwaG90by1wYWdlfHx8fGVufDB8fHx8fA%3D%3D
Vintage Style Coat Rack,A freestanding coat rack in an antique bronze finish with six double hooks. Elegant and practical for entryways.,159.99,12,Home Decor,https://images.unsplash.com/photo-1592178034856-845669eff0d8?q=80&w=987&auto=format&fit=crop&ixlib=rb-4.1.0&ixid=M3wxMjA3fDB8MHxwaG90by1wYWdlfHx8fGVufDB8fHx8fA%3D%3D
Upholstered Wingback Chair,A classic wingback chair upholstered in a warm caramel fabric. Features a solid wood frame and nailhead trim.,849.99,5,Sofas & Armchairs,https://images.unsplash.com/photo-1722357533644-9b20e356ba5f?q=80&w=1180&auto=format&fit=crop&ixlib=rb-4.1.0&ixid=M3wxMjA3fDB8MHxwaG90by1wYWdlfHx8fGVufDB8fHx8fA%3D%3D
Marble Top Side Table,An elegant side table with a genuine marble top and brushed gold legs. A luxurious accent for living rooms and bedrooms.,349.99,8,Tables & Chairs,https://images.unsplash.com/photo-1717416699020-9e3a3ff2351a?q=80&w=987&auto=format&fit=crop&ixlib=rb-4.1.0&ixid=M3wxMjA3fDB8MHxwaG90by1wYWdlfHx8fGVufDB8fHx8fA%3D%3D
Vintage Persian Style Rug,A richly patterned Persian-style area rug in deep jewel tones of burgundy and navy. Hand-knotted for durability and beauty.,899.99,4,Rugs & Home Textiles,https://images.unsplash.com/photo-1594847915592-2a7ef568e2b6?q=80&w=910&auto=format&fit=crop&ixlib=rb-4.1.0&ixid=M3wxMjA3fDB8MHxwaG90by1wYWdlfHx8fGVufDB8fHx8fA%3D%3D
Linen Upholstered Bed Frame,A minimalist bed frame upholstered in soft grey linen with a low-profile headboard. Available in Queen and King.,1199.99,5,Beds & Mattresses,https://plus.unsplash.com/premium_photo-1682663742998-9cacb3d6728e?q=80&w=1026&auto=format&fit=crop&ixlib=rb-4.1.0&ixid=M3wxMjA3fDB8MHxwaG90by1wYWdlfHx8fGVufDB8fHx8fA%3D%3D
Brass Geometric Candle Sconce,A set of two wall-mounted brass candle sconces in a bold geometric design. Adds architectural interest to walls.,139.99,16,Lighting,https://images.unsplash.com/photo-1662042769653-252de8b7c306?q=80&w=1035&auto=format&fit=crop&ixlib=rb-4.1.0&ixid=M3wxMjA3fDB8MHxwaG90by1wYWdlfHx8fGVufDB8fHx8fA%3D%3D
Spindle Back Dining Chairs Set of 4,A set of four classic spindle-back dining chairs in a natural oak finish. Timeless design that complements any dining table.,699.99,4,Tables & Chairs,https://plus.unsplash.com/premium_photo-1684445034763-013f0525c40c?q=80&w=987&auto=format&fit=crop&ixlib=rb-4.1.0&ixid=M3wxMjA3fDB8MHxwaG90by1wYWdlfHx8fGVufDB8fHx8fA%3D%3D
Carved Wooden Trinket Box,A beautifully hand-carved wooden trinket box with floral motifs. Perfect for storing jewelry and small keepsakes.,49.99,22,Home Decor,https://images.unsplash.com/photo-1672664003230-106aa4f534c7?q=80&w=987&auto=format&fit=crop&ixlib=rb-4.1.0&ixid=M3wxMjA3fDB8MHxwaG90by1wYWdlfHx8fGVufDB8fHx8fA%3D%3D
Hammered Copper Vase,A stunning hammered copper vase with a rustic patina finish. Makes a striking centerpiece for dining tables and shelves.,89.99,17,Home Decor,https://images.unsplash.com/photo-1643722060220-6a729cb7c3b4?q=80&w=926&auto=format&fit=crop&ixlib=rb-4.1.0&ixid=M3wxMjA3fDB8MHxwaG90by1wYWdlfHx8fGVufDB8fHx8fA%3D%3D
Rattan Headboard,A handwoven rattan headboard that brings a natural boho feel to any bedroom. Available in Queen and King sizes.,399.99,7,Beds & Mattresses,https://images.unsplash.com/photo-1757417983938-2c2a931d41aa?q=80&w=987&auto=format&fit=crop&ixlib=rb-4.1.0&ixid=M3wxMjA3fDB8MHxwaG90by1wYWdlfHx8fGVufDB8fHx8fA%3D%3D
Vintage Map Framed Print,A large framed vintage-style world map print in sepia tones. A classic piece for home offices and living rooms.,129.99,14,Home Decor,https://images.unsplash.com/photo-1723306743407-cb6ac8f19941?q=80&w=2122&auto=format&fit=crop&ixlib=rb-4.1.0&ixid=M3wxMjA3fDB8MHxwaG90by1wYWdlfHx8fGVufDB8fHx8fA%3D%3D
Oak TV Console,A solid oak TV console with two drawers and open shelving. Clean lines and warm wood tones suit any living room style.,649.99,6,Storage Furniture,https://images.unsplash.com/photo-1664908791396-06604db3b36c?q=80&w=987&auto=format&fit=crop&ixlib=rb-4.1.0&ixid=M3wxMjA3fDB8MHxwaG90by1wYWdlfHx8fGVufDB8fHx8fA%3D%3D
Velvet Throw Cushions Set of 4,A set of four luxurious velvet throw cushions in complementary muted tones. Instantly elevates sofas and beds.,119.99,20,Rugs & Home Textiles,https://images.unsplash.com/photo-1559051668-9024c9b5e84b?q=80&w=1035&auto=format&fit=crop&ixlib=rb-4.1.0&ixid=M3wxMjA3fDB8MHxwaG90by1wYWdlfHx8fGVufDB8fHx8fA%3D%3D
Industrial Desk Lamp,A classic industrial-style desk lamp with an adjustable arm and Edison bulb. Perfect for home offices and bedside tables.,99.99,18,Lighting,https://images.unsplash.com/photo-1645454720244-29f8e894f662?q=80&w=987&auto=format&fit=crop&ixlib=rb-4.1.0&ixid=M3wxMjA3fDB8MHxwaG90by1wYWdlfHx8fGVufDB8fHx8fA%3D%3D
Farmhouse Kitchen Island,A charming farmhouse kitchen island with a butcher block top and two shelves below. Adds storage and workspace to any kitchen.,899.99,4,Tables & Chairs,https://images.unsplash.com/photo-1768486143865-342d8cc12c90?q=80&w=1770&auto=format&fit=crop&ixlib=rb-4.1.0&ixid=M3wxMjA3fDB8MHxwaG90by1wYWdlfHx8fGVufDB8fHx8fA%3D%3D
Woven Seagrass Floor Basket,A large handwoven seagrass floor basket with handles. Ideal for storing blankets,79.99,24,Storage Furniture,https://images.unsplash.com/photo-1674473919007-06576be5d0d3?q=80&w=987&auto=format&fit=crop&ixlib=rb-4.1.0&ixid=M3wxMjA3fDB8MHxwaG90by1wYWdlfHx8fGVufDB8fHx8fA%3D%3D
Elm Wood Dining Table,A solid elm wood dining table with a live-edge top and black steel legs. Seats 6.,1199.99,4,Tables & Chairs,https://images.unsplash.com/photo-1668067516409-f3bb960ab4a2?q=80&w=987&auto=format&fit=crop&ixlib=rb-4.1.0&ixid=M3wxMjA3fDB8MHxwaG90by1wYWdlfHx8fGVufDB8fHx8fA%3D%3D
Folding Bistro Table,A compact round bistro table in powder-coated steel with a mosaic tile top.,279.99,10,Tables & Chairs,https://plus.unsplash.com/premium_photo-1677646871461-80df119a10d6?q=80&w=987&auto=format&fit=crop&ixlib=rb-4.1.0&ixid=M3wxMjA3fDB8MHxwaG90by1wYWdlfHx8fGVufDB8fHx8fA%3D%3D
Glass and Brass Console Table,A slim console table with a smoked glass top and antique brass frame.,449.99,6,Tables & Chairs,https://plus.unsplash.com/premium_photo-1706560278067-b3fb6cba1e4c?q=80&w=987&auto=format&fit=crop&ixlib=rb-4.1.0&ixid=M3wxMjA3fDB8MHxwaG90by1wYWdlfHx8fGVufDB8fHx8fA%3D%3D
Hairpin Leg Side Table,A minimalist side table with a solid oak top and black hairpin legs.,169.99,15,Tables & Chairs,https://images.unsplash.com/photo-1621350597530-02305519e9f6?q=80&w=987&auto=format&fit=crop&ixlib=rb-4.1.0&ixid=M3wxMjA3fDB8MHxwaG90by1wYWdlfHx8fGVufDB8fHx8fA%3D%3D
Extendable Round Table,A round extendable dining table in white lacquer. Expands from 4 to 8 seats.,1099.99,3,Tables & Chairs,https://images.unsplash.com/photo-1749476101600-90b2eb7efa89?q=80&w=987&auto=format&fit=crop&ixlib=rb-4.1.0&ixid=M3wxMjA3fDB8MHxwaG90by1wYWdlfHx8fGVufDB8fHx8fA%3D%3D
Chaise Lounge,A sleek chaise lounge upholstered in dusty rose linen with a walnut frame.,1099.99,2,Sofas & Armchairs,https://images.unsplash.com/photo-1760716478282-9d72559112cd?q=80&w=1064&auto=format&fit=crop&ixlib=rb-4.1.0&ixid=M3wxMjA3fDB8MHxwaG90by1wYWdlfHx8fGVufDB8fHx8fA%3D%3D
Papasan Chair,An oversized papasan chair with a thick woven cushion in warm ivory.,449.99,6,Sofas & Armchairs,https://img-us.aosomcdn.com/thumbnail/100/n0/product/2025/05/09/l8y5a2196b2a35700.jpg.webp
Modular Sectional Sofa,Modular Sectional Sofa,2399.99,2,Sofas & Armchairs,https://images.unsplash.com/photo-1565330502541-4937be8552e3?q=80&w=988&auto=format&fit=crop&ixlib=rb-4.1.0&ixid=M3wxMjA3fDB8MHxwaG90by1wYWdlfHx8fGVufDB8fHx8fA%3D%3D
Barrel Chair,A cozy barrel accent chair upholstered in warm cognac boucle with a swivel base.,699.99,5,Sofas & Armchairs,https://images.unsplash.com/photo-1759722667394-000072b59a3a?q=80&w=1054&auto=format&fit=crop&ixlib=rb-4.1.0&ixid=M3wxMjA3fDB8MHxwaG90by1wYWdlfHx8fGVufDB8fHx8fA%3D%3D
Rocking Chair,A classic solid oak rocking chair with a cushioned seat in natural linen.,599.99,6,Sofas & Armchairs,https://images.unsplash.com/photo-1585072820698-fe6f41dba127?q=80&w=987&auto=format&fit=crop&ixlib=rb-4.1.0&ixid=M3wxMjA3fDB8MHxwaG90by1wYWdlfHx8fGVufDB8fHx8fA%3D%3D
Canopy Bed Frame,A romantic four-poster canopy bed frame in solid walnut. Available in Queen and King.,1899.99,3,Beds & Mattresses,https://shoppe.amberinteriordesign.com/cdn/shop/products/shoppe-amber-interiors-5X4A8544-7_1_1512x.jpg?v=1649969430
Upholstered Headboard King,A tall upholstered King-size headboard in deep navy velvet with channel tufting.,449.99,1,Beds & Mattresses,https://images.unsplash.com/photo-1698956696531-b8c7e44653f2?q=80&w=987&auto=format&fit=crop&ixlib=rb-4.1.0&ixid=M3wxMjA3fDB8MHxwaG90by1wYWdlfHx8fGVufDB8fHx8fA%3D%3D
Trundle Bed Frame,A solid pine trundle bed with a pull-out second bed. Ideal for guest rooms.,849.99,5,Beds & Mattresses,https://images.unsplash.com/photo-1630183477346-685bc849cda6?q=80&w=1064&auto=format&fit=crop&ixlib=rb-4.1.0&ixid=M3wxMjA3fDB8MHxwaG90by1wYWdlfHx8fGVufDB8fHx8fA%3D%3D
Bunk Bed with Desk,A solid wood bunk bed with an integrated desk and shelving below.,1299.99,2,Beds & Mattresses,https://casakids.com/cdn/shop/files/l-shaped-bunk-bed-with-ladder-and-hanging-desk-birch-white-casakids_b059b8dd-4c46-4206-8181-76a9aa2d15f2_2000x.jpg?v=1758928674
Daybed Frame,A versatile daybed frame in black iron that doubles as a sofa. Includes slatted base.,799.99,4,Beds & Mattresses,https://img-us.aosomcdn.com/thumbnail/100/n0/product/2024/10/25/dq637e192c2d96300.jpg.webp
Globe Pendant Light,A large smoked glass globe pendant light with a matte black ceiling rose.,229.99,10,Lighting,https://images.unsplash.com/photo-1770306924359-e03cc4c860e0?q=80&w=987&auto=format&fit=crop&ixlib=rb-4.1.0&ixid=M3wxMjA3fDB8MHxwaG90by1wYWdlfHx8fGVufDB8fHx8fA%3D%3D
Brass Wall Sconce Set,A set of two antique brass wall sconces with aged linen shades.,199.99,12,Lighting,https://images.unsplash.com/photo-1659100171587-a8a5e9d9417a?q=80&w=987&auto=format&fit=crop&ixlib=rb-4.1.0&ixid=M3wxMjA3fDB8MHxwaG90by1wYWdlfHx8fGVufDB8fHx8fA%3D%3D
Mushroom Table Lamp,A sculptural mushroom-shaped table lamp in warm amber glass with a linen shade.,169.99,15,Lighting,https://images.unsplash.com/photo-1759753874998-5e0182e07af6?q=80&w=987&auto=format&fit=crop&ixlib=rb-4.1.0&ixid=M3wxMjA3fDB8MHxwaG90by1wYWdlfHx8fGVufDB8fHx8fA%3D%3D
Arc Floor Lamp,A dramatic arc floor lamp with a marble base and adjustable gold arm.,379.99,6,Lighting,https://images.unsplash.com/photo-1726389838683-8ff57378c1c5?q=80&w=987&auto=format&fit=crop&ixlib=rb-4.1.0&ixid=M3wxMjA3fDB8MHxwaG90by1wYWdlfHx8fGVufDB8fHx8fA%3D%3D
Tripod Floor Lamp,A mid-century modern tripod floor lamp in natural teak with a drum shade.,319.99,7,Lighting,https://images.unsplash.com/photo-1710082777338-dcb6189ae64f?q=80&w=987&auto=format&fit=crop&ixlib=rb-4.1.0&ixid=M3wxMjA3fDB8MHxwaG90by1wYWdlfHx8fGVufDB8fHx8fA%3D%3D
Pegboard Wall Organizer,A large pine pegboard with 12 hooks and two small shelves. Great for offices and kitchens.,99.99,18,Storage Furniture,https://images.unsplash.com/photo-1720526234765-ad8d166002f8?q=80&w=927&auto=format&fit=crop&ixlib=rb-4.1.0&ixid=M3wxMjA3fDB8MHxwaG90by1wYWdlfHx8fGVufDB8fHx8fA%3D%3D
Ottoman Storage Box,A large upholstered storage ottoman in sage green with a hinged lid.,329.99,5,Storage Furniture,https://images.unsplash.com/photo-1745562294790-e783f3e92d8e?q=80&w=1770&auto=format&fit=crop&ixlib=rb-4.1.0&ixid=M3wxMjA3fDB8MHxwaG90by1wYWdlfHx8fGVufDB8fHx8fA%3D%3D
Cube Shelving Unit,A 9-cube shelving unit in white lacquer. Mix open display with fabric basket storage.,379.99,9,Storage Furniture,https://images.unsplash.com/photo-1768393992748-8e58b9ab321d?q=80&w=1180&auto=format&fit=crop&ixlib=rb-4.1.0&ixid=M3wxMjA3fDB8MHxwaG90by1wYWdlfHx8fGVufDB8fHx8fA%3D%3D
Antique Display Cabinet,A glass-fronted display cabinet in dark mahogany with brass hardware.,949.99,8,Storage Furniture,https://images.unsplash.com/photo-1761472096034-5c228267bef6?q=80&w=987&auto=format&fit=crop&ixlib=rb-4.1.0&ixid=M3wxMjA3fDB8MHxwaG90by1wYWdlfHx8fGVufDB8fHx8fA%3D%3D
Entryway Shoe Cabinet,A slim shoe cabinet with flip-down doors and a bench seat on top.,299.99,3,Storage Furniture,https://images.unsplash.com/photo-1600422086908-72be2c8f5f3f?q=80&w=986&auto=format&fit=crop&ixlib=rb-4.1.0&ixid=M3wxMjA3fDB8MHxwaG90by1wYWdlfHx8fGVufDB8fHx8fA%3D%3D
Berber Area Rug,A plush Berber-style area rug in cream and warm grey tones.,379.99,7,Rugs & Home Textiles,https://images.unsplash.com/photo-1620230757457-772a4712a926?q=80&w=1015&auto=format&fit=crop&ixlib=rb-4.1.0&ixid=M3wxMjA3fDB8MHxwaG90by1wYWdlfHx8fGVufDB8fHx8fA%3D%3D
Outdoor Area Rug,A flatweave outdoor rug in a bold indigo geometric pattern. UV resistant.,169.99,14,Rugs & Home Textiles,https://images.unsplash.com/photo-1655638591371-4ccec3d56046?q=80&w=1035&auto=format&fit=crop&ixlib=rb-4.1.0&ixid=M3wxMjA3fDB8MHxwaG90by1wYWdlfHx8fGVufDB8fHx8fA%3D%3D
Faux Fur Throw,An ultra-soft faux fur throw in ivory white. Adds instant luxury to any sofa.,109.99,20,Rugs & Home Textiles,https://images.unsplash.com/photo-1627242139059-dad4e1ab1621?q=80&w=987&auto=format&fit=crop&ixlib=rb-4.1.0&ixid=M3wxMjA3fDB8MHxwaG90by1wYWdlfHx8fGVufDB8fHx8fA%3D%3D
Hand-Embroidered Cushion Set,A set of two linen cushion covers with hand-embroidered floral motifs in terracotta.,84.99,21,Rugs & Home Textiles,https://images.unsplash.com/photo-1650742032309-5f0e1c20abf4?q=80&w=987&auto=format&fit=crop&ixlib=rb-4.1.0&ixid=M3wxMjA3fDB8MHxwaG90by1wYWdlfHx8fGVufDB8fHx8fA%3D%3D
Chunky Knit Blanket,A hand-knitted chunky wool blanket in oatmeal white. Perfect for cold evenings.,139.99,16,Rugs & Home Textiles,https://plus.unsplash.com/premium_photo-1664033881717-1980c19d9ade?q=80&w=1064&auto=format&fit=crop&ixlib=rb-4.1.0&ixid=M3wxMjA3fDB8MHxwaG90by1wYWdlfHx8fGVufDB8fHx8fA%3D%3D
Roman Blind,A classic Roman blind in natural flax linen. Easy to install and operate.,99.99,17,Window Treatments,https://www.direct-fabrics.co.uk/media/catalog/product/cache/65a66a69886091754797701695bfa85a/r/o/roman-blinds-made-with-roman-blind-kits.png
Bamboo Roller Blind,A natural bamboo roller blind that filters light beautifully. Eco-friendly.,74.99,22,Window Treatments,https://images.unsplash.com/photo-1767798614035-31557222ddfd?q=80&w=1036&auto=format&fit=crop&ixlib=rb-4.1.0&ixid=M3wxMjA3fDB8MHxwaG90by1wYWdlfHx8fGVufDB8fHx8fA%3D%3D
Velvet Blackout Curtains,A pair of deep forest green velvet blackout curtains. Blocks light completely.,159.99,14,Window Treatments,https://images.unsplash.com/photo-1640292767657-3c817244f77b?q=80&w=987&auto=format&fit=crop&ixlib=rb-4.1.0&ixid=M3wxMjA3fDB8MHxwaG90by1wYWdlfHx8fGVufDB8fHx8fA%3D%3D
Eyelet Curtains Blush,A pair of lined eyelet curtains in soft blush pink. Ready to hang.,89.99,20,Window Treatments,https://images.unsplash.com/photo-1771039621800-fb28e227575c?q=80&w=1051&auto=format&fit=crop&ixlib=rb-4.1.0&ixid=M3wxMjA3fDB8MHxwaG90by1wYWdlfHx8fGVufDB8fHx8fA%3D%3D
Jute Curtain Tie Backs,A set of two natural jute rope curtain tie backs with wooden rings.,29.99,35,Window Treatments,https://images.unsplash.com/photo-1673845749526-0787b858f226?q=80&w=987&auto=format&fit=crop&ixlib=rb-4.1.0&ixid=M3wxMjA3fDB8MHxwaG90by1wYWdlfHx8fGVufDB8fHx8fA%3D%3D
Tall Standing Planter,A floor-standing planter in matte black powder-coated steel with tapered legs.,94.99,16,Pots & Plants,https://images.unsplash.com/photo-1661916123448-116815d2f40b?q=80&w=988&auto=format&fit=crop&ixlib=rb-4.1.0&ixid=M3wxMjA3fDB8MHxwaG90by1wYWdlfHx8fGVufDB8fHx8fA%3D%3D
Self-Watering Ceramic Planter,A modern self-watering planter in speckled white ceramic with a drainage system.,59.99,22,Pots & Plants,https://images.unsplash.com/photo-1685453628585-2b338030ae64?q=80&w=927&auto=format&fit=crop&ixlib=rb-4.1.0&ixid=M3wxMjA3fDB8MHxwaG90by1wYWdlfHx8fGVufDB8fHx8fA%3D%3D
Woven Seagrass Plant Basket Set,A set of three woven seagrass plant baskets in graduated sizes with handles.,49.99,28,Pots & Plants,https://images.unsplash.com/photo-1730904713929-a08a8f0c80cc?q=80&w=1064&auto=format&fit=crop&ixlib=rb-4.1.0&ixid=M3wxMjA3fDB8MHxwaG90by1wYWdlfHx8fGVufDB8fHx8fA%3D%3D
